query,precision,recall
What adaptations were made based on the game Valkyria Chronicles 3?,0.0,0.0
What actions were taken by Captain Totten in response to the situation at the Little Rock Arsenal in 1861?,0.0285204991087344,0.32904884318766064
Why wasn't Valkyria Chronicles III released in the West?,0.017320534223706177,0.39903846153846156
What triggered the assembly of militia units in Little Rock in early 1861?,0.044088615924544855,0.22259136212624583
What were the contents of the Little Rock Arsenal's inventory after its seizure in February 1861?,0.05668202764976959,1.0
What were the criticisms of Valkyria Chronicles III noted by reviewers?,0.0,0.0
What role did Takeshi Ozawa play in the development of Valkyria Chronicles III?,0.021695052716950526,1.0
What were the primary reasons for Kurt Irving's decision to reestablish his squad as the Nameless at the end of the war with the Empire?,0.05850283078213462,1.0
What are the key themes explored in the anime adaptation of Valkyria Chronicles III?,0.0,0.0
How did Governor Rector respond to the unauthorized assembly of militia at the Little Rock Arsenal?,0.024365887757140003,0.3065326633165829
What additional content was released for Valkyria Chronicles III after its initial launch?,0.021818923327895597,1.0
What were the main reasons for developing Valkyria Chronicles III for PlayStation Portable instead of PlayStation 3?,0.06297174897563079,1.0
What actions led to the Nameless being formally recognized as a squad in the Gallian Army?,0.052967848309975266,1.0
What events led to the construction of the Little Rock Arsenal?,0.057555555555555554,1.0
What events marked the public debut of Valkyria Chronicles III?,0.0,0.0
What role did the Little Rock Arsenal serve immediately prior to its seizure in 1861?,0.046857142857142854,1.0
"What role does Gallian Army Squad 422, also known as 'The Nameless,' play during the Second Europan War?",0.1380873866446826,0.9852941176470589
What were the consequences of the telegraph dispatched by John M Harrel from Little Rock in 1861?,0.05526527331189711,0.6740196078431373
What challenges did Honjou face while designing the characters for the Nameless Squad in Valkyria Chronicles III?,0.06999143835616438,1.0
What are the main characteristics of Gallian Army Squad 422 in Valkyria Chronicles III?,0.09838187702265372,0.9785407725321889
What historical significance does the Tower Building hold in relation to General Douglas MacArthur?,0.05847707193941944,1.0
What was the main purpose of using the State Library's public documents during the Confederate period?,0.040034624540142824,1.0
Which Valkyria Chronicles characters were featured in the Nintendo 3DS crossover Project X Zone?,0.023449157962055,1.0
What specific research did the production team undertake for creating the anime adaptation of Valkyria Chronicles?,0.0,0.0
What was the purpose of the episodic Flash visual novel released leading into the events of Valkyria Chronicles III?,0.0,0.0
What major event led to Ramsey Crowe being escorted to the capital city in Valkyria Chronicles III?,0.06227645697454239,1.0
What role did Ramsey Crowe play in the rehabilitation of the Nameless in Valkyria Chronicles III?,0.06255283178360102,1.0
What feedback did Ryan Geddes of IGN provide on the TGS demo of the game?,0.04053489343919766,1.0
What led to the move of Kurt's squad into an independent position at the end of Valkyria Chronicles III?,0.06010340370529944,0.5205223880597015
What specific actions were attributed to Rick Nash regarding his potential trade from Columbus?,0.02626680455015512,0.5019762845849802
What are the primary themes of the song 'There's Got to Be a Way' as described in the text?,0.019753660237043922,0.23097826086956522
What buildings were constructed in the park where the Tower Building is located?,0.007174509390166702,0.1504424778761062
What was the primary focus of Cicely Mary Barker's fairy illustrations?,0.03423499577345731,1.0
What were the initial and revised budgets for the construction of the Little Rock Arsenal?,0.024572899602153055,0.7241379310344828
What is Cicely Mary Barker best known for?,0.03463018383924754,1.0
What factors contributed to the Near Threatened status of the plain maskray?,0.02495955627455512,0.16216216216216217
What were the major changes in team structure for the Blue Jackets during the off-season?,0.03599476439790576,0.3241650294695481
Who were the officers under Lt. Col. Dunnington's command at Little Rock during August 1862?,0.03884164559871294,1.0
What was the purpose of building the Gregorian Tower?,0.06513741614369184,1.0
"What abilities do the characters Kurt, Imca, and Riela possess in the game?",0.07202955058485533,1.0
How did the Blue Jackets perform in penalty kill situations during the season?,0.0,0.0
Who were the experts involved in the construction and equipment setup of the Gregorian Tower?,0.05193681021423934,0.7384615384615385
What are the critical reception details for Mariah Carey's song 'There's Got to Be a Way'?,0.04680851063829787,0.7627737226277372
What influence did Cicely Mary Barker's early environment have on her art?,0.04603741854109733,1.0
What were the early influences on Barker's art during her childhood?,0.04670505438259757,1.0
What operations were initiated at the Little Rock Arsenal by the Arkansas Military Board?,0.03360655737704918,0.6188679245283019
What was the nature of the social issues addressed in the song 'There's Got to Be a Way' by Mariah Carey?,0.08331466965285554,1.0
What is the maximum lifespan of male and female plain maskrays?,0.02001953125,1.0
What led to the firing of Head Coach Scott Arniel during the 2011-12 Columbus Blue Jackets season?,0.022932884494003786,1.0
What were the significant events related to Jeff Carter during the 2010-11 NHL season?,0.02414313429618452,0.5714285714285714
What was the final point total for the Columbus Blue Jackets in the described season?,0.0,0.0
What inspired the anime title for Valkyria Chronicles III?,0.0,0.0
What are the dietary preferences of the plain maskray?,0.016408597180494568,0.26296296296296295
What are the book titles published by Blackie?,0.014105642256902761,0.27011494252873564
What are the different remixes of 'There's Got to Be a Way' listed?,0.010261194029850746,0.2953020134228188
What are the challenges faced in the development of women's football in Gambia?,0.08537422751201648,0.8735362997658079
What decorations are featured in the interior of the Meridian Hall?,0.01702862783810464,0.25650557620817843
What did Mary Violet Clayton Calthrop write about Barker's Flower Fairies of the Spring in 1925?,0.04183651576914825,1.0
What was the contribution of Sakimoto to the anime adaptation of Valkyria Chronicles III?,0.011092507325240687,1.0
What instruments were procured for the revival of the observatory on the Gregorian Tower?,0.03653065584276864,0.5074183976261127
What were the main characteristics of the armor used on the ship Atlanta?,0.036681850875089905,0.6986301369863014
What are the published works of the Gambia women's national football team?,0.023804074158846417,0.20155038759689922
What educational path did Cicely Mary Barker take in her early years?,0.05009552112078115,1.0
What is the purpose of the sundial in the Meridian Room?,0.04421098708688991,0.643312101910828
What actions did the NHL take to investigate the clock pause?,0.03510292524377032,1.0
What were the significant events in the operational history of the USS Atlanta during the American Civil War?,0.024014100022031283,0.25586854460093894
What are the names of the main female protagonists in the two manga adaptations of Valkyria Chronicles III?,0.0,0.0
What steps did John P. McConnell mention in a letter around the trade deadline and the Entry Draft?,0.02687296416938111,1.0
What were the outcomes of the 2012 NHL Entry Draft lottery for the Columbus Blue Jackets?,0.04179498460184778,1.0
What were the consequences for the Columbus Blue Jackets after losing to the Edmonton Oilers 6-3?,0.04352703612295266,0.5878787878787879
What were the circumstances surrounding Shawn Hunwick's one-day contract with the Blue Jackets?,0.056112224448897796,0.44680851063829785
How were the observations carried out at the observatory under Mgr. Gilii's supervision?,0.034025629695095004,0.5273972602739726
Where were the recording and mixing locations for Mariah Carey's song 'There's Got to Be a Way'?,0.029235880398671095,0.6875
What religious-themed artworks were produced by Barker for the Society for Promoting Christian Knowledge?,0.0,0.0
What alterations were made to the second tower when it was designated the seat of the Vatican Observatory?,0.05674709562109026,1.0
What was the impact of Blue Jackets' losing streaks on their season standings?,0.04286345558992488,0.470873786407767
"Who composed the music for Valkyria Chronicles III, and what was unique about the musical themes?",0.0,0.0
What cards did she design for the Society for Promoting Christian Knowledge?,0.04056958624395486,1.0
What was the fate of the ship Atlanta after it was sold to Haiti?,0.029930394431554524,1.0
What international competitions has the Gambia women's national football team not participated in?,0.04252899704343871,1.0
How are points calculated for players in NHL statistics?,0.021764032073310423,1.0
What are the various public uses of the Tower Building from 1911 through 1936?,0.022693531283138918,0.3128654970760234
"Who was in charge of the observatory from 1800 to 1821, and what were the primary tasks conducted under his management?",0.03716065865598576,0.5202492211838006
Who collaborated with Dorothy Barker on book publications?,0.0,0.0
What were the key historical events that led to modifications at the Vatican Observatory during Pope Pius X's era?,0.07734204793028322,1.0
What mediums did Barker use in her artwork?,0.019407123053956067,0.5986842105263158
"Who developed, produced, directed, and wrote the anime adaptation of Valkyria Chronicles III?",0.0,0.0
What were the outcomes of the Columbus Blue Jackets' games during their first three-game win streak of the season?,0.024927665257066547,1.0
What were the manufacturing capabilities of the Little Rock Arsenal after Major General Thomas C. Hindman took command?,0.037146475306036306,0.5517241379310345
What are the main challenges faced by the squad known as the Nameless in Valkyria Chronicles III?,0.0,0.0
What types of work were performed at the Little Rock Arsenal during the month of August 1862?,0.08000911784818783,1.0
What was the original purpose of the ship Atlanta during the American Civil War before it was captured by the Union?,0.024014100022031283,0.28835978835978837
Who wrote the lyrics for the opening theme song of Valkyria Chronicles III?,0.0,0.0
What are the different classes of troops in the military unit described?,0.01937046004842615,1.0
What are the details of Cicely Mary Barker's role in her sister's kindergarten?,0.022241604884430877,0.3217665615141956
Who succeeded Josiah Tattnall as commander of the Savannah squadron?,0.0357593605384939,1.0
What were Barker's initial artistic achievements?,0.016634676903390915,0.2698961937716263
What was the main color of the Nameless in Valkyria Chronicles III?,0.009195402298850575,1.0
What modifications were made to the observatory for astronomical observations during the third stage?,0.05547062677440489,1.0
What were the two manga adaptations of Senjō no Valkyria 3?,0.06646525679758308,0.5416666666666666
What were the outcomes of Columbus Blue Jackets' trade attempts during the NHL trade deadline period?,0.0,0.0
What were the key findings from the phylogenetic analysis of the plain maskray conducted in 2012?,0.04178208679593721,1.0
What impact did Jeff Carter's acquisition have on the Columbus Blue Jackets as perceived by the fans and management?,0.025742988698200082,0.4155405405405405
What were the consequences of Jeff Carter's foot injury for the Columbus Blue Jackets?,0.02413793103448276,0.5714285714285714
Who wrote the song 'There's Got to Be a Way' by Mariah Carey?,0.02866741321388578,0.6368159203980099
"What historical impacts did Japanese, Chinese, and Taiwanese trawlers have on the plain maskray?",0.04136815345504969,1.0
What were the outcomes of the Blue Jackets' games immediately following goaltender Steve Mason's injury?,0.031893236824247904,0.2675521821631879
What were the Columbus Blue Jackets' records with Ken Hitchcock as coach compared to their start of the season?,0.03426171529619806,1.0
What historical events impacted the naming of MacArthur Park in 1942?,0.029767441860465118,1.0
What were the professional affiliations of Cicely Mary Barker's children-themed artworks?,0.047837894297054526,0.4673469387755102
What are the specific decorations described for the interior walls and ceiling of the hall in the tower?,0.015121630506245891,0.25650557620817843
What were the results of the Blue Jackets' games led by goaltender York?,0.03966070609812013,0.5884353741496599
What were the actions taken by Bulloch on the night of 12 November during the Fingal expedition?,0.02838766910623198,1.0
What are the main character abilities in the battle system of Valkyria Chronicles?,0.0,0.0
What were the differences in lyrical themes between 'There's Got to Be a Way' and 'Vision of Love'?,0.05218365061590145,1.0
What were the release dates for the DVD versions of the Valkyria Chronicles 3 anime?,0.02940535830973644,1.0
What divisions did the Blue Jackets belong to during the season described?,0.027254597828495458,1.0
What were the significant changes to the observatory at the Roman College after Mgr. Gilii's death?,0.034666666666666665,0.6215139442231076
Who was responsible for the initial construction of the tower intended for astronomical observations?,0.03641580225115868,1.0
What were the significant events during Columbus Blue Jackets' game described in the text?,0.027039309247898206,0.3296398891966759
What role did Queen Christina of Sweden play in the history of the Meridian Room?,0.031077804716773197,1.0
What are the major intersections described for Nebraska Highway 88?,0.05591748099891422,1.0
What institutions were merged to form the Arkansas Museum of Discovery?,0.037551020408163265,1.0
What are the titles of the religious-themed books by Barker mentioned in the text?,0.022099447513812154,1.0
What were some of the thematic focuses in the artworks of Barker?,0.034122414160801876,0.3018867924528302
What are the classes of troops in the game?,0.01937046004842615,1.0
What roles did Dorothy Oswald Barker undertake to support the family?,0.0,0.0
What allegations did Scott Howson make regarding the clock incident during the Blue Jackets' game against the Kings?,0.07888146911519199,1.0
What was the content of Cicely Mary Barker's book 'Groundsel and Necklaces'?,0.0,0.0
Who performed the percussion for 'There's Got to Be a Way'?,0.00816231343283582,1.0
What are the traffic statistics for the N @-@ 71 / N @-@ 88 concurrency measured in 2012?,0.056443298969072166,1.0
What were the musical elements used in 'There's Got to Be a Way' by Mariah Carey?,0.019036954087346025,1.0
What are the characteristics of the plain maskray's tail?,0.0260989010989011,0.29765013054830286
What were the career milestones for Vaclav during the NHL season discussed?,0.013276327632763277,1.0
What modifications were made to the Gregorian Tower during the third stage of its revival?,0.054261909848323006,1.0
What are the two museums housed in the Tower Building of the Little Rock Arsenal?,0.01544231193470108,0.3153153153153153
What prompted the transfer of the tower building and the adjacent land to the city of Little Rock?,0.08967331725498794,1.0
What modifications were made to the Little Rock Arsenal building prior to its 1880 renovation?,0.034421496779924496,1.0
What events contributed to the Columbus Blue Jackets' decision to hire Todd Richards as interim coach?,0.04430911381772364,0.5158924205378973
What were the functions of the sundial and the <unk> installed in the Meridian Hall during the Gregorian Calendar Reform?,0.04440536381622335,0.5459459459459459
What were the results of the transactions involving Rick Nash by the Columbus Blue Jackets?,0.04119696659151465,0.2842998585572843
"What changes occurred to the designations of N @-@ 29, N @-@ 19, and US 26 near Bridgeport?",0.024972557628979142,1.0
"How did the Columbus Blue Jackets perform in March and early April, including details of winning streaks and playoff contention status?",0.06060606060606061,0.5856832971800434
What was the outcome of Mason's return game against the Vancouver Canucks after his concussion?,0.02402334979793444,0.300561797752809
